{
  "schema_version": "bpa.scenario.v1",
  "scenario_id": "synthetic-handover-consent-expiry",
  "description": "A simulated handover succeeds visually, but a later request must be denied after consent expires.",
  "consent": {
    "subject_ref": "synthetic-subject-001",
    "purpose": "laboratory-handover",
    "scope": "robot-hand-handover",
    "valid_from_ms": 0,
    "valid_until_ms": 2000,
    "revoked_at_ms": null
  },
  "identity_assertion": {
    "subject_ref": "synthetic-subject-001",
    "verified": true,
    "expires_at_ms": 3000
  },
  "policy": {
    "min_model_confidence": 0.8,
    "require_bci_intent": true,
    "require_human_approval": true
  },
  "action_requests": [
    {
      "request_id": "handover-1",
      "at_ms": 1000,
      "purpose": "laboratory-handover",
      "scope": "robot-hand-handover",
      "bci_intent_present": true,
      "model_confidence": 0.95,
      "safety_clear": true,
      "human_approved": true,
      "expected_allow": true
    },
    {
      "request_id": "handover-2",
      "at_ms": 2200,
      "purpose": "laboratory-handover",
      "scope": "robot-hand-handover",
      "bci_intent_present": true,
      "model_confidence": 0.98,
      "safety_clear": true,
      "human_approved": true,
      "expected_allow": false
    }
  ]
}
